{
  "apiVersion": "chronicle.dev/v1alpha1",
  "kind": "Bundle",
  "runId": "example-run",
  "scenario": "scenario.yaml",
  "targets": ["baseline.target.yaml", "candidate.target.yaml"],
  "images": [
    {
      "name": "fulfillment-projector",
      "reference": "ghcr.io/example/fulfillment-projector@sha256:aaaaaaaaaaaaaaaaaaaaaaaaaaaaaaaaaaaaaaaaaaaaaaaaaaaaaaaaaaaaaaaa"
    }
  ],
  "resources": {"cpus": 2, "memoryBytes": 1073741824, "diskBytes": 10737418240},
  "files": [
    {
      "path": "scenario.yaml",
      "sha256": "cccccccccccccccccccccccccccccccccccccccccccccccccccccccccccccccc",
      "size": 4096
    }
  ],
  "safety": {"maxFiles": 1000, "maxExpandedBytes": 1073741824, "symlinksAllowed": false}
}
